timestamp	room	experiment	file_changed	score	baseline	delta	status	description
2026-04-12T04:54:00	prompts	8	.agent/prompts/verifier.md	0.0000	0.0000	+0.0000	discard	simplify and clarify the wording in the identity and role section
2026-04-12T04:54:03	prompts	9	.agent/prompts/verifier.md	0.0000	0.0000	+0.0000	discard	simplify and clarify the Regla de Oro statement for conciseness
2026-04-12T04:54:04	prompts	10		0	0.0	0	error	proposal error: Could not parse proposal: {
  "file": ".agent/prompts/verifier.md",
  "description": "simplify Equil
2026-04-13T05:21:35	validator	1	tools/validate_submission.py	0.6667	0.6667	+0.0000	discard	Remove re.IGNORECASE flag from RSN detection regex to improve precision.
2026-04-13T05:21:38	validator	2	tools/validate_submission.py	0.6667	0.6667	+0.0000	discard	Remove unnecessary re.IGNORECASE flag from RSN detection regex to reduce false positives
2026-04-13T05:22:22	validator	3	tools/validate_submission.py	0.6667	0.6667	+0.0000	discard	Remove re.IGNORECASE flag from RSN detection regex to reduce potential false positives.
2026-04-13T05:22:24	validator	4	tools/validate_submission.py	0.6667	0.6667	+0.0000	discard	Remove re.IGNORECASE from RSN detection to potentially reduce false positives.
2026-04-13T05:22:26	validator	5	tools/validate_submission.py	0.6667	0.6667	+0.0000	discard	Remove re.IGNORECASE flag from RSN detection regex to potentially reduce false positives.
2026-04-13T05:22:28	validator	6	tools/validate_submission.py	0.6667	0.6667	+0.0000	discard	remove re.IGNORECASE from RSN detection regex to reduce potential false positives
2026-04-13T05:22:30	validator	7	tools/validate_submission.py	0.6667	0.6667	+0.0000	discard	Remove re.IGNORECASE from RSN detection regex to reduce potential false positives
2026-04-13T05:22:32	validator	8	tools/validate_submission.py	0.6667	0.6667	+0.0000	discard	Remove re.IGNORECASE from RSN detection regex to potentially reduce false positives
2026-04-13T05:22:34	validator	9	tools/validate_submission.py	0.6667	0.6667	+0.0000	discard	Remove re.IGNORECASE from RSN detection regex to potentially improve precision and reduce false positives.
2026-04-13T05:22:36	validator	10	tools/validate_submission.py	0.6667	0.6667	+0.0000	discard	Remove re.IGNORECASE flag from the RSN detection regex to prevent potential false positives.
2026-04-14T04:51:52	prompts	1	.agent/prompts/physical_critic.md	0.0000	0.0000	+0.0000	discard	simplify the activation conditions by consolidating similar triggers into one bullet
2026-04-14T04:52:21	prompts	2	.agent/prompts/physical_critic.md	0.0000	0.0000	+0.0000	discard	clarify activation conditions by making them more precise and concise
2026-04-14T04:52:24	prompts	3		0	0.0	0	error	proposal error: Could not parse proposal: {
  "file": ".agent/prompts/physical_critic.md",
  "description": "clarify
2026-04-14T04:52:26	prompts	4	.agent/prompts/physical_critic.md	0.0000	0.0000	+0.0000	discard	simplify the checklist item for y+ consistency within 'Dominio air' to improve clarity
2026-04-14T04:52:28	prompts	5	.agent/prompts/physical_critic.md	0	0.0	0	apply_failed	apply failed: simplify and clarify the wording in the identity and role section for better readability
2026-04-14T04:52:31	prompts	6		0	0.0	0	error	proposal error: Could not parse proposal: {
  "file": ".agent/prompts/physical_critic.md",
  "description": "simplif
2026-04-14T04:52:33	prompts	7	.agent/prompts/physical_critic.md	0.0000	0.0000	+0.0000	discard	simplify the activation conditions for clarity
2026-04-14T04:52:36	prompts	8	.agent/prompts/physical_critic.md	0.0000	0.0000	+0.0000	discard	simplify activation condition related to modifications to geometry
2026-04-14T04:52:37	prompts	9	.agent/prompts/physical_critic.md	0.0000	0.0000	+0.0000	discard	simplify and clarify the Protocolo Engram Bus section for conciseness
2026-04-14T04:52:40	prompts	10	.agent/prompts/physical_critic.md	0.0000	0.0000	+0.0000	discard	simplify the activation conditions by consolidating similar triggers
2026-04-15T04:52:18	prompts	1	.agent/prompts/verifier.md	0.0000	0.0000	+0.0000	discard	simplify PASO 4 to make coherence checks more concise and aligned with other steps
2026-04-15T04:52:57	prompts	2	.agent/prompts/verifier.md	0.0000	0.0000	+0.0000	discard	Simplify the phrasing in the Regla de Oro section for conciseness
2026-04-15T04:52:59	prompts	3	.agent/prompts/verifier.md	0.0000	0.0000	+0.0000	discard	simplify and clarify the rule for SSOT hash verification to improve clarity and compliance
2026-04-15T04:53:02	prompts	4	.agent/prompts/verifier.md	0.0000	0.0000	+0.0000	discard	Simplify and clarify the SSOT_HASH pass/fail reporting in the final report structure.
2026-04-15T04:53:04	prompts	5	.agent/prompts/verifier.md	0.0000	0.0000	+0.0000	discard	simplify activation conditions for clarity
2026-04-15T04:53:06	prompts	6	.agent/prompts/verifier.md	0	0.0	0	apply_failed	apply failed: simplify and clarify the activation conditions for readability
2026-04-15T04:53:08	prompts	7	.agent/prompts/verifier.md	0.0000	0.0000	+0.0000	discard	simplify and clarify the Regla de Oro to focus on the core principle
2026-04-15T04:53:10	prompts	8	.agent/prompts/verifier.md	0.0000	0.0000	+0.0000	discard	simplify Condiciones de Activación by consolidating triggers into clearer categories
2026-04-15T04:53:13	prompts	9	.agent/prompts/verifier.md	0.0000	0.0000	+0.0000	discard	simplify the hash comparison instruction in PASO 0 for clarity
2026-04-15T04:53:15	prompts	10	.agent/prompts/verifier.md	0.0000	0.0000	+0.0000	discard	clarify action steps for hash mismatch in PASO 0
2026-04-16T05:11:28	prompts	1	.agent/prompts/physical_critic.md	0.0000	0.0000	+0.0000	discard	Simplify the Protocol Engram Bus activation steps for clarity
2026-04-16T05:12:04	prompts	2	.agent/prompts/physical_critic.md	0.0000	0.0000	+0.0000	discard	simplify 'Checklist de Fallos' title for clarity
2026-04-16T05:12:06	prompts	3	.agent/prompts/physical_critic.md	0.0000	0.0000	+0.0000	discard	Simplify the activation condition by consolidating triggers to improve clarity and focus.
2026-04-16T05:12:08	prompts	4	.agent/prompts/physical_critic.md	0.0000	0.0000	+0.0000	discard	clarify checklist items by explicitly defining the failure thresholds in one consistent format
2026-04-16T05:12:10	prompts	5		0	0.0	0	error	proposal error: Could not parse proposal: \n⚠️ PHYSICAL CRITIC ALERT\nModo de fallo detectado: [pandeo | torsión | i
2026-04-16T05:12:12	prompts	6	.agent/prompts/physical_critic.md	0.0000	0.0000	+0.0000	discard	simplify and clarify the activation conditions
2026-04-16T05:12:15	prompts	7	.agent/prompts/physical_critic.md	0.0000	0.0000	+0.0000	discard	remove redundant phrase in the identity section to simplify clarity
2026-04-16T05:12:16	prompts	8	.agent/prompts/physical_critic.md	0.0000	0.0000	+0.0000	discard	simplify the activation conditions by consolidating triggers for clarity
2026-04-16T05:12:18	prompts	9	.agent/prompts/physical_critic.md	0.0000	0.0000	+0.0000	discard	simplify the Condiciones de Activación by consolidating triggers for clarity
2026-04-16T05:12:20	prompts	10	.agent/prompts/physical_critic.md	0.0000	0.0000	+0.0000	discard	simplify the checklist for Fallo por Cortante en Nodos to improve clarity and prompt compliance
2026-04-17T05:09:19	skills	1	.agent/skills/paper_production.md	0.0000	0.0000	+0.0000	discard	clarify rule about COMPUTE to explicitly state that data in the final paper must come from real simulations or empirical results
2026-04-17T05:09:22	skills	2	.agent/skills/paper_production.md	0.0000	0.0000	+0.0000	discard	remove redundant explanation about COMPUTE phase blocking IMPLEMENT to improve clarity
2026-04-17T05:09:24	skills	3	.agent/skills/paper_production.md	0	0.0	0	apply_failed	apply failed: remove redundant explanation about orchestrator not generating content to improve clarity
2026-04-17T05:09:25	skills	4	.agent/skills/paper_production.md	0.0000	0.0000	+0.0000	discard	clarify the role of the orchestrator in the SPEC phase
2026-04-17T05:09:28	skills	5	.agent/skills/paper_production.md	0.0000	0.0000	+0.0000	discard	remove redundant wording in FUNDAMENTAL RULE to improve clarity and conciseness
2026-04-17T05:09:30	skills	6	.agent/skills/paper_production.md	0	0.0	0	apply_failed	apply failed: clarify and simplify text in the SPEC phase instructions to improve clarity
2026-04-17T05:09:32	skills	7	.agent/skills/paper_production.md	0	0.0	0	apply_failed	apply failed: clarify COMPUTE phase requirements by emphasizing its mandatory nature with simpler language
2026-04-17T05:09:34	skills	8	.agent/skills/paper_production.md	0	0.0	0	apply_failed	apply failed: remove redundancy in the description of skipping COMPUTE and writing results without proper data
2026-04-17T05:09:36	skills	9		0	0.0	0	error	proposal error: Could not parse proposal: {
  "file": ".agent/skills/paper_production.md",
  "description": "clarify
2026-04-17T05:09:38	skills	10	.agent/skills/paper_production.md	0	0.0	0	apply_failed	apply failed: remove redundant reference to method names in The Specificity Rule for more clarity
2026-04-18T04:39:51	skills	1	.agent/skills/signal_processing.md	0.0000	0.0000	+0.0000	discard	simplify and clarify the SSOT explanation for Kalman parameters Q and R
2026-04-18T04:39:53	skills	2	.agent/skills/signal_processing.md	0.0000	0.0000	+0.0000	discard	simplify instruction for SSOT for Kalman parameters
2026-04-18T04:40:38	skills	3	.agent/skills/signal_processing.md	0.0000	0.0000	+0.0000	discard	simplify verifier integration step to improve structure
2026-04-18T04:40:40	skills	4	.agent/skills/signal_processing.md	0.0000	0.0000	+0.0000	discard	simplify Kalman vs Buffer section for clarity and focus
2026-04-18T04:40:42	skills	5	.agent/skills/signal_processing.md	0.0000	0.0000	+0.0000	discard	simplify redundant explanation of Kalman filter Q and R parameters
2026-04-18T04:40:43	skills	6	.agent/skills/signal_processing.md	0.0000	0.0000	+0.0000	discard	simplify phrasing in 'SSOT for Kalman parameters' for better clarity
2026-04-18T04:40:45	skills	7	.agent/skills/signal_processing.md	0.0000	0.0000	+0.0000	discard	simplify explanation of Verifier integration for clarity
2026-04-18T04:40:47	skills	8	.agent/skills/signal_processing.md	0.0000	0.0000	+0.0000	discard	clarify the importance of SSOT for Kalman parameters by emphasizing its role in maintaining consistency and accuracy
2026-04-18T04:40:49	skills	9	.agent/skills/signal_processing.md	0.0000	0.0000	+0.0000	discard	simplify and clarify STEP 7 description for Verifier integration
2026-04-18T04:40:51	skills	10	.agent/skills/signal_processing.md	0.0000	0.0000	+0.0000	discard	simplify explanation of Kalman filter parameters Q and R for clarity
2026-04-19T05:10:10	validator	1	tools/validate_submission.py	0	0.6667	0	apply_failed	apply failed: Remove re.IGNORECASE from RSN regex to reduce potential false positives
2026-04-19T05:10:13	validator	2	tools/validate_submission.py	0.6667	0.6667	+0.0000	discard	Remove re.IGNORECASE flag from RSN detection regex to potentially increase precision and reduce false positives
2026-04-19T05:10:15	validator	3	tools/validate_submission.py	0.6667	0.6667	+0.0000	discard	Remove re.IGNORECASE from RSN detection regex to reduce potential false positives
2026-04-19T05:10:58	validator	4	tools/validate_submission.py	0	0.6667	0	apply_failed	apply failed: Restrict AI prose blacklist to remove subjectively vague or less meaningful entries to reduce false positives.
2026-04-19T05:11:01	validator	5	tools/validate_submission.py	0.6667	0.6667	+0.0000	discard	Remove `re.IGNORECASE` from RSN detection regex to potentially improve precision and reduce false positives
2026-04-19T05:11:03	validator	6	tools/validate_submission.py	0.6667	0.6667	+0.0000	discard	Adjust the RSN detection regex to prevent false positives by removing the re.IGNORECASE flag.
2026-04-19T05:11:06	validator	7	tools/validate_submission.py	0.6667	0.6667	+0.0000	discard	Remove re.IGNORECASE from RSN detection regex to reduce potential false positives.
2026-04-19T05:11:08	validator	8	tools/validate_submission.py	0.6667	0.6667	+0.0000	discard	Remove re.IGNORECASE from RSN detection regex to reduce potential false positives
2026-04-19T05:11:11	validator	9	tools/validate_submission.py	0	0.6667	0	apply_failed	apply failed: Remove re.IGNORECASE from RSN detection regex to reduce potential false positives
2026-04-19T05:11:13	validator	10	tools/validate_submission.py	0.6667	0.6667	+0.0000	discard	Remove re.IGNORECASE from RSN detection regex to reduce potential false positives
2026-04-20T05:20:46	validator	1	tools/validate_submission.py	0.6667	0.6667	+0.0000	discard	Remove re.IGNORECASE from the RSN detection regex to reduce potential false positives
2026-04-20T05:21:16	validator	2	tools/validate_submission.py	0.6667	0.6667	+0.0000	discard	Remove unnecessary `re.IGNORECASE` from RSN detection regex to potentially reduce false positives.
2026-04-20T05:21:18	validator	3	tools/validate_submission.py	0.6667	0.6667	+0.0000	discard	Remove re.IGNORECASE flag from RSN detection regex to reduce false positives.
2026-04-20T05:21:20	validator	4	tools/validate_submission.py	0.6667	0.6667	+0.0000	discard	Remove re.IGNORECASE from RSN detection regex to reduce potential false positives
2026-04-20T05:21:22	validator	5	tools/validate_submission.py	0.6667	0.6667	+0.0000	discard	Remove re.IGNORECASE flag from RSN detection regex to reduce false positives.
2026-04-20T05:21:24	validator	6	tools/validate_submission.py	0.6667	0.6667	+0.0000	discard	Remove re.IGNORECASE from RSN detection regex to potentially reduce false positives
2026-04-20T05:21:27	validator	7	tools/validate_submission.py	0.6667	0.6667	+0.0000	discard	Remove re.IGNORECASE from RSN detection regex to reduce false positives
2026-04-20T05:21:29	validator	8	tools/validate_submission.py	0.6667	0.6667	+0.0000	discard	Remove re.IGNORECASE from RSN detection regex to reduce potential false positives.
2026-04-20T05:21:31	validator	9	tools/validate_submission.py	0.6667	0.6667	+0.0000	discard	Remove re.IGNORECASE from RSN detection regex to reduce false positives.
2026-04-20T05:21:32	validator	10	tools/validate_submission.py	0.6667	0.6667	+0.0000	discard	Improve RSN detection by removing re.IGNORECASE flag to reduce false positives
2026-04-21T05:08:20	simulation	1	src/physics/spectral_engine.py	0	0.0	0	apply_failed	apply failed: remove unnecessary sys.path modification for cleaner imports
2026-04-21T05:08:22	simulation	2	src/physics/spectral_engine.py	0	0.0	0	apply_failed	apply failed: remove unnecessary sys.path modification to simplify imports
2026-04-21T05:08:24	simulation	3	src/physics/spectral_engine.py	0	0.0	0	apply_failed	apply failed: remove unnecessary sys.path modification to simplify imports
2026-04-21T05:08:26	simulation	4	src/physics/spectral_engine.py	0	0.0	0	apply_failed	apply failed: remove sys.path modification to improve modularity and avoid potential import issues
2026-04-21T05:08:27	simulation	5	src/physics/spectral_engine.py	0	0.0	0	apply_failed	apply failed: remove unnecessary sys.path modification for cleaner imports
2026-04-21T05:08:29	simulation	6	src/physics/spectral_engine.py	0	0.0	0	apply_failed	apply failed: remove unnecessary sys.path modification to streamline imports
2026-04-21T05:08:30	simulation	7	src/physics/spectral_engine.py	0	0.0	0	apply_failed	apply failed: remove unnecessary sys.path modification for cleaner imports
2026-04-21T05:08:32	simulation	8	src/physics/spectral_engine.py	0	0.0	0	apply_failed	apply failed: remove unnecessary sys.path modification for cleaner import management
2026-04-21T05:08:33	simulation	9	src/physics/spectral_engine.py	0	0.0	0	apply_failed	apply failed: remove unnecessary sys.path modification for cleaner code
2026-04-21T05:08:35	simulation	10	src/physics/spectral_engine.py	0	0.0	0	apply_failed	apply failed: remove unnecessary sys.path modification to simplify imports and avoid potential issues
2026-04-22T04:52:37	prompts	1	.agent/prompts/verifier.md	0.0000	0.0000	+0.0000	discard	simplify the rule for rejecting results to improve clarity
2026-04-22T04:52:40	prompts	2	.agent/prompts/verifier.md	0.0000	0.0000	+0.0000	discard	simplify activation conditions for clarity
2026-04-22T04:52:42	prompts	3	.agent/prompts/verifier.md	0.0000	0.0000	+0.0000	discard	simplify activation conditions by combining similar triggers into a single sentence for better clarity
2026-04-22T04:53:21	prompts	4	.agent/prompts/verifier.md	0.0000	0.0000	+0.0000	discard	simplify the phrasing of the golden rule for clarity
2026-04-22T04:53:23	prompts	5	.agent/prompts/verifier.md	0.0000	0.0000	+0.0000	discard	simplify and clarify the Guardrail of Fluencia criteria
2026-04-22T04:53:26	prompts	6	.agent/prompts/verifier.md	0.0000	0.0000	+0.0000	discard	Simplify the wording of the 'Condiciones de Activación' section for clarity.
2026-04-22T04:53:28	prompts	7	.agent/prompts/verifier.md	0.0000	0.0000	+0.0000	discard	Improve clarity by simplifying the description of COMPUTE Verification checks.
2026-04-22T04:53:31	prompts	8	.agent/prompts/verifier.md	0.0000	0.0000	+0.0000	discard	clarify that non-convergence in any step immediately results in reporting and blocking pipeline
2026-04-22T04:53:33	prompts	9	.agent/prompts/verifier.md	0.0000	0.0000	+0.0000	discard	simplify the wording for the Regla de Oro for clarity and brevity
2026-04-22T04:53:35	prompts	10	.agent/prompts/verifier.md	0.0000	0.0000	+0.0000	discard	simplify conditions for immediate pipeline abort in PASO 0
2026-04-23T05:10:18	simulation	1	src/physics/torture_chamber.py	0	0.0	0	apply_failed	apply failed: remove unnecessary sys.path modification to streamline imports
2026-04-23T05:10:20	simulation	2	src/physics/torture_chamber.py	0	0.0	0	apply_failed	apply failed: remove unnecessary sys.path modification to streamline imports
2026-04-23T05:10:22	simulation	3	src/physics/torture_chamber.py	0	0.0	0	apply_failed	apply failed: remove unnecessary sys.path modification to streamline imports
2026-04-23T05:11:08	simulation	4	src/physics/torture_chamber.py	0	0.0	0	apply_failed	apply failed: remove redundant sys.path modification to simplify imports
2026-04-23T05:11:10	simulation	5	src/physics/torture_chamber.py	0	0.0	0	apply_failed	apply failed: remove unnecessary sys.path modification for cleaner imports
2026-04-23T05:11:11	simulation	6	src/physics/torture_chamber.py	0	0.0	0	apply_failed	apply failed: remove unnecessary sys.path modification to simplify imports
2026-04-23T05:11:13	simulation	7	src/physics/torture_chamber.py	0	0.0	0	apply_failed	apply failed: remove unnecessary sys.path modification to streamline imports
2026-04-23T05:11:15	simulation	8	src/physics/torture_chamber.py	0	0.0	0	apply_failed	apply failed: Remove unnecessary sys.path modification to streamline imports
2026-04-23T05:11:16	simulation	9	src/physics/torture_chamber.py	0	0.0	0	apply_failed	apply failed: remove unnecessary sys.path modification to clean imports
2026-04-23T05:11:17	simulation	10	src/physics/torture_chamber.py	0	0.0	0	apply_failed	apply failed: remove unnecessary sys.path modification to streamline imports
2026-04-24T05:15:36	skills	1	.agent/skills/paper_production.md	0	0.0	0	apply_failed	apply failed: clarify the fundamental rule about the necessity of real data for paper production
2026-04-24T05:15:49	skills	2	.agent/skills/paper_production.md	0.0000	0.0000	+0.0000	discard	Remove redundant statement for brevity and to improve clarity
2026-04-24T05:15:51	skills	3	.agent/skills/paper_production.md	0.0000	0.0000	+0.0000	discard	remove redundant sub-phase title for brevity and clarity in COMPUTE section
2026-04-24T05:15:54	skills	4	.agent/skills/paper_production.md	0.0000	0.0000	+0.0000	discard	simplify and clarify the description of the EXPLORE phase to improve understanding
2026-04-24T05:15:56	skills	5	.agent/skills/paper_production.md	0.0000	0.0000	+0.0000	discard	simplify the description of the orchestrator's role in SDD Flow
2026-04-24T05:15:58	skills	6	.agent/skills/paper_production.md	0.0000	0.0000	+0.0000	discard	simplify phrasing by removing redundant text in EXPLORE step
2026-04-24T05:16:00	skills	7	.agent/skills/paper_production.md	0	0.0	0	apply_failed	apply failed: remove the redundant point about EXPLORE phase to reduce redundancy
2026-04-24T05:16:01	skills	8	.agent/skills/paper_production.md	0	0.0	0	apply_failed	apply failed: clarify task decomposition by adding a new bullet to specify input/output explicitly
2026-04-24T05:16:04	skills	9	.agent/skills/paper_production.md	0.0000	0.0000	+0.0000	discard	simplify repetitive expression in EXPLORE section for conciseness
2026-04-24T05:16:06	skills	10	.agent/skills/paper_production.md	0.0000	0.0000	+0.0000	discard	simplify phrasing of sentence for conciseness and clarity in EXPLORE section
2026-04-25T04:42:58	skills	1	.agent/skills/signal_processing.md	0.0000	0.0000	+0.0000	discard	extend the 'When to Use' section for better coverage by adding elaboration on use cases
2026-04-25T04:43:01	skills	2	.agent/skills/signal_processing.md	0.0000	0.0000	+0.0000	discard	add explicit mention of output format for processed signal
2026-04-25T04:43:03	skills	3	.agent/skills/signal_processing.md	0.0000	0.0000	+0.0000	discard	add explicit mention of input (raw sensor data) and output (filtered data) for clarity
2026-04-25T04:43:04	skills	4	.agent/skills/signal_processing.md	0.0000	0.0000	+0.0000	discard	clarify and expand Verifier integration step for consistency and coverage
2026-04-25T04:43:58	skills	5	.agent/skills/signal_processing.md	0.0000	0.0000	+0.0000	discard	clarify Verifier integration by replacing STEP 7 description with more concise actionable phrasing
2026-04-25T04:44:00	skills	6	.agent/skills/signal_processing.md	0.0000	0.0000	+0.0000	discard	clarify when to use by specifying context for debugging phase lag
2026-04-25T04:44:01	skills	7	.agent/skills/signal_processing.md	0.0000	0.0000	+0.0000	discard	clarify when to use the skill by listing specific scenarios for Verifier usage
2026-04-25T04:44:03	skills	8	.agent/skills/signal_processing.md	0.0000	0.0000	+0.0000	discard	clarify the purpose of Q and R parameters in Kalman filter for improved comprehension
2026-04-25T04:44:05	skills	9		0	0.0	0	error	proposal error: Could not parse proposal: {
  "file": ".agent/skills/signal_processing.md",
  "description": "clarif
2026-04-25T04:44:07	skills	10	.agent/skills/signal_processing.md	0.0000	0.0000	+0.0000	discard	clarify when to use Verifier integration for Kalman experiments
2026-04-26T05:19:27	validator	1	tools/validate_submission.py	0.6667	0.6667	+0.0000	discard	Remove re.IGNORECASE from RSN detection regex to reduce potential false positives
2026-04-26T05:19:51	validator	2	tools/validate_submission.py	0.6667	0.6667	+0.0000	discard	Remove re.IGNORECASE flag from RSN detection to reduce false positives from case-insensitive matches.
2026-04-26T05:19:54	validator	3	tools/validate_submission.py	0.6667	0.6667	+0.0000	discard	Remove re.IGNORECASE from RSN detection to potentially reduce false positives.
2026-04-26T05:19:56	validator	4	tools/validate_submission.py	0.6667	0.6667	+0.0000	discard	Remove re.IGNORECASE flag from RSN detection regex to reduce false positives in suggest_traceability function.
2026-04-26T05:19:58	validator	5	tools/validate_submission.py	0.6667	0.6667	+0.0000	discard	simplify RSN detection by removing re.IGNORECASE flag to reduce potential false positives
2026-04-26T05:20:00	validator	6	tools/validate_submission.py	0.6667	0.6667	+0.0000	discard	remove re.IGNORECASE from the RSN detection regex to reduce false positives
2026-04-26T05:20:03	validator	7	tools/validate_submission.py	0	0.6667	0	apply_failed	apply failed: Remove re.IGNORECASE from the RSN detection regex to prevent potential false positives.
2026-04-26T05:20:05	validator	8	tools/validate_submission.py	0.6667	0.6667	+0.0000	discard	Remove 're.IGNORECASE' from RSN detection to potentially reduce false positives.
2026-04-26T05:20:07	validator	9	tools/validate_submission.py	0.6667	0.6667	+0.0000	discard	Remove re.IGNORECASE from RSN detection regex to reduce false positives
2026-04-26T05:20:09	validator	10	tools/validate_submission.py	0.6667	0.6667	+0.0000	discard	Remove re.IGNORECASE from RSN regex to reduce potential false positives.
2026-04-27T05:32:02	validator	1	tools/validate_submission.py	0.6667	0.6667	+0.0000	discard	Remove re.IGNORECASE from RSN detection to reduce false positives
2026-04-27T05:32:46	validator	2	tools/validate_submission.py	0.6667	0.6667	+0.0000	discard	Remove re.IGNORECASE from RSN detection regex to potentially reduce false positives
2026-04-27T05:32:49	validator	3	tools/validate_submission.py	0	0.6667	0	apply_failed	apply failed: Remove overly generic phrase 'it should be noted' from AI_BLACKLISTED_PHRASES to reduce false positives.
2026-04-27T05:32:51	validator	4	tools/validate_submission.py	0	0.6667	0	apply_failed	apply failed: Remove 're.IGNORECASE' from the AI prose blacklist pattern to reduce false positives.
2026-04-27T05:32:52	validator	5	tools/validate_submission.py	0.6667	0.6667	+0.0000	discard	Remove re.IGNORECASE flag from RSN detection to reduce false positives.
2026-04-27T05:32:54	validator	6	tools/validate_submission.py	0.6667	0.6667	+0.0000	discard	Remove 're.IGNORECASE' from RSN detection regex to reduce potential false positives
2026-04-27T05:32:56	validator	7	tools/validate_submission.py	0.6667	0.6667	+0.0000	discard	Remove re.IGNORECASE from RSN detection regex to reduce false positives
2026-04-27T05:32:58	validator	8	tools/validate_submission.py	0.6667	0.6667	+0.0000	discard	Remove re.IGNORECASE from RSN detection to reduce false positives
2026-04-27T05:33:01	validator	9	tools/validate_submission.py	0.6667	0.6667	+0.0000	discard	Remove re.IGNORECASE from the RSN detection regex to reduce false positives
2026-04-27T05:33:03	validator	10	tools/validate_submission.py	0.6667	0.6667	+0.0000	discard	Remove re.IGNORECASE from RSN regex to reduce false positives
