timestamp	room	experiment	file_changed	score	baseline	delta	status	description
2026-03-10T16:01:27	validator	1	tools/validate_submission.py	0.6667	0.6667	+0.0000	discard	Simplify RSN detection by removing unnecessary re.IGNORECASE flag in the regex pattern.
2026-03-10T16:01:30	validator	2	tools/validate_submission.py	0	0.6667	0	apply_failed	apply failed: remove ambiguous wording in AI detection phrases to improve precision
2026-03-10T16:01:32	validator	3	tools/validate_submission.py	0	0.6667	0	apply_failed	apply failed: Remove redundant check for 'AI_Assist markers' which may falsely increase false positives.
2026-03-11T04:16:11	validator	1	tools/validate_submission.py	0.6667	0.6667	+0.0000	discard	Remove redundant re.IGNORECASE flag from RSN regex pattern as RSNs are case-insensitive by definition.
2026-03-11T04:16:14	validator	2	tools/validate_submission.py	0.6667	0.6667	+0.0000	discard	Simplify RSN regex to avoid unnecessary re.IGNORECASE flag, potentially reducing false positives.
2026-03-11T04:16:16	validator	3	tools/validate_submission.py	0.6667	0.6667	+0.0000	discard	remove the re.IGNORECASE flag for RSN patterns for stricter matching
2026-03-11T04:16:18	validator	4	tools/validate_submission.py	0.6667	0.6667	+0.0000	discard	Remove unnecessary re.IGNORECASE flag in RSN regex to simplify detection logic and reduce over-detection.
2026-03-11T04:16:19	validator	5	tools/validate_submission.py	0.6667	0.6667	+0.0000	discard	Remove re.IGNORECASE flag from AI_BLACKLISTED_PHRASES regex patterns to improve precision
2026-03-11T04:16:21	validator	6	tools/validate_submission.py	0.6667	0.6667	+0.0000	discard	simplify RSN pattern matching to focus on specific case-sensitive format
2026-03-11T04:16:23	validator	7	tools/validate_submission.py	0.6667	0.6667	+0.0000	discard	Remove re.IGNORECASE flag when finding 'RSN' patterns to potentially reduce false positives
2026-03-11T04:16:25	validator	8	tools/validate_submission.py	0	0.6667	0	apply_failed	apply failed: Simplify RSN and figure patterns by removing re.IGNORECASE for better precision.
2026-03-11T04:16:27	validator	9	tools/validate_submission.py	0.6667	0.6667	+0.0000	discard	simplify RSN detection by removing redundant re.IGNORECASE flag
2026-03-11T04:16:29	validator	10	tools/validate_submission.py	0.6667	0.6667	+0.0000	discard	Remove re.IGNORECASE flag from RSN regex to reduce false positives in case-sensitive RSN detection
2026-03-12T04:20:54	validator	1	tools/validate_submission.py	0.6667	0.6667	+0.0000	discard	Remove redundant re.IGNORECASE for RSN detection to improve precision.
2026-03-12T04:20:57	validator	2	tools/validate_submission.py	0.6667	0.6667	+0.0000	discard	remove re.IGNORECASE flag in RSN detection to reduce false positives
2026-03-12T04:21:40	validator	3	tools/validate_submission.py	0.6667	0.6667	+0.0000	discard	Remove re.IGNORECASE flag from RSN regex for potentially reducing false positives
2026-03-12T04:21:42	validator	4	tools/validate_submission.py	0.6667	0.6667	+0.0000	discard	Remove re.IGNORECASE flag for RSN detection to improve case-sensitive pattern matching
2026-03-12T04:21:44	validator	5	tools/validate_submission.py	0.6667	0.6667	+0.0000	discard	Remove re.IGNORECASE flag from RSN regex to reduce false positives in case-sensitive RSN detection.
2026-03-12T04:21:45	validator	6	tools/validate_submission.py	0.6667	0.6667	+0.0000	discard	Remove re.IGNORECASE flag from RSN pattern matching to improve precision
2026-03-12T04:21:47	validator	7	tools/validate_submission.py	0.6667	0.6667	+0.0000	discard	remove re.IGNORECASE flag in RSN detection to reduce false positives
2026-03-12T04:21:49	validator	8	tools/validate_submission.py	0.6667	0.6667	+0.0000	discard	Remove re.IGNORECASE flag from RSN detection regex to reduce false positives.
2026-03-12T04:21:51	validator	9	tools/validate_submission.py	0.6667	0.6667	+0.0000	discard	Remove re.IGNORECASE flag from RSN detection to improve case-sensitive precision.
2026-03-12T04:21:53	validator	10	tools/validate_submission.py	0.6667	0.6667	+0.0000	discard	Remove re.IGNORECASE flag from RSN regex to improve case-sensitive detection accuracy
2026-03-13T04:20:03	prompts	1	.agent/prompts/verifier.md	0.0000	0.0000	+0.0000	discard	simplify explanatory text in Regla de Oro del Verifier for clarity
2026-03-13T04:20:29	prompts	2	.agent/prompts/verifier.md	0.0000	0.0000	+0.0000	discard	simplify rule for reading parameters from firmware to reduce cognitive load and ensure clarity
2026-03-13T04:20:31	prompts	3	.agent/prompts/verifier.md	0.0000	0.0000	+0.0000	discard	clarify the rule for immediate blocking when SSOT hash doesn't match
2026-03-13T04:20:33	prompts	4	.agent/prompts/verifier.md	0.0000	0.0000	+0.0000	discard	simplify rule in the identity and role section by removing redundant emphasis sentence
2026-03-13T04:20:34	prompts	5	.agent/prompts/verifier.md	0.0000	0.0000	+0.0000	discard	Simplify and clarify the report header format
2026-03-13T04:20:36	prompts	6	.agent/prompts/verifier.md	0.0000	0.0000	+0.0000	discard	simplify the communication of the result's provenance in step 8
2026-03-13T04:20:37	prompts	7	.agent/prompts/verifier.md	0.0000	0.0000	+0.0000	discard	simplify redundant warning criteria in `PASO 7 — Verificación "Shadow Play" (Sensor Drift)` to make it more concise
2026-03-13T04:20:40	prompts	8	.agent/prompts/verifier.md	0.0000	0.0000	+0.0000	discard	clarify failure reporting in PASO 4 — Coherencia Firmware ↔ Simulación
2026-03-13T04:20:41	prompts	9	.agent/prompts/verifier.md	0.0000	0.0000	+0.0000	discard	simplify redundant instructions for step 0 Hash SSOT to improve clarity
2026-03-13T04:20:44	prompts	10	.agent/prompts/verifier.md	0.0000	0.0000	+0.0000	discard	simplify rule about max stress levels to eliminate potential confusion
2026-03-14T04:18:09	skills	1	.agent/skills/paper_production.md	0	0.0	0	apply_failed	apply failed: remove repeated redundancy in BAD and GOOD examples section for conciseness
2026-03-14T04:18:43	skills	2	.agent/skills/paper_production.md	0	0.0	0	apply_failed	apply failed: remove repetitive and redundant phrasing in 'Structural Rules' to improve clarity
2026-03-14T04:18:45	skills	3	.agent/skills/paper_production.md	0	0.0	0	apply_failed	apply failed: simplify tone guidelines to improve clarity by removing redundant points
2026-03-14T04:18:47	skills	4	.agent/skills/paper_production.md	0.0000	0.0000	+0.0000	discard	clarify the rule about skipping 'EXPLORE' in anti-patterns section to avoid confusion
2026-03-14T04:18:48	skills	5	.agent/skills/paper_production.md	0	0.0	0	apply_failed	apply failed: remove redundant phrase with no new information
2026-03-14T04:18:50	skills	6	.agent/skills/paper_production.md	0.0000	0.0000	+0.0000	discard	Removed repetitive guidance about ARCHIVE phase to focus on its essential purpose.
2026-03-14T04:18:51	skills	7	.agent/skills/paper_production.md	0.0000	0.0000	+0.0000	discard	simplify redundancy in descriptions of skipped actions in Anti-Patterns section
2026-03-14T04:18:53	skills	8	.agent/skills/paper_production.md	0	0.0	0	apply_failed	apply failed: clarify COMPUTE step requirements to emphasize the importance of real data
2026-03-14T04:18:55	skills	9	.agent/skills/paper_production.md	0	0.0	0	apply_failed	apply failed: remove redundancy by deleting 'SPEC and DESIGN run in parallel (both depend only on EXPLORE/PROPOSE)' which is implied by the diagram
2026-03-14T04:18:56	skills	10	.agent/skills/paper_production.md	0.0000	0.0000	+0.0000	discard	clarify the importance of running `validate_submission.py` before `compile_paper.sh`
2026-03-15T04:39:13	skills	1	.agent/skills/signal_processing.md	0.0000	0.0000	+0.0000	discard	simplify and clarify reference to unit verification for Kalman output
2026-03-15T04:39:22	skills	2	.agent/skills/signal_processing.md	0.0000	0.0000	+0.0000	discard	Remove redundant phrase about uncontrolled phase lag for clarity.
2026-03-15T04:39:23	skills	3	.agent/skills/signal_processing.md	0.0000	0.0000	+0.0000	discard	clarify critical pattern on Kalman filter usage to improve structure
2026-03-15T04:39:24	skills	4	.agent/skills/signal_processing.md	0.0000	0.0000	+0.0000	discard	simplify redundancy in describing Kalman filter parameters and focus on clarity
2026-03-15T04:39:26	skills	5	.agent/skills/signal_processing.md	0.0000	0.0000	+0.0000	discard	remove redundancy in explanation of Q and R parameters
2026-03-15T04:39:27	skills	6	.agent/skills/signal_processing.md	0.0000	0.0000	+0.0000	discard	simplify explanation of Verifier integration step for clarity
2026-03-15T04:39:29	skills	7	.agent/skills/signal_processing.md	0.0000	0.0000	+0.0000	discard	simplify overly technical explanation of Q and R parameters in SSOT section
2026-03-15T04:39:30	skills	8	.agent/skills/signal_processing.md	0.0000	0.0000	+0.0000	discard	simplify anti-pattern regarding aborting on single spike for clarity and focus
2026-03-15T04:39:31	skills	9	.agent/skills/signal_processing.md	0.0000	0.0000	+0.0000	discard	simplify redundant explanation of Kalman filter parameters Q and R
2026-03-15T04:39:32	skills	10	.agent/skills/signal_processing.md	0	0.0	0	apply_failed	apply failed: remove redundancy by deleting detailed Kalman filter parameter description
2026-03-16T04:46:41	skills	1	.agent/skills/paper_production.md	0	0.0	0	apply_failed	apply failed: remove redundant explanation about orchestrator generating content directly
2026-03-16T04:46:43	skills	2	.agent/skills/paper_production.md	0.0000	0.0000	+0.0000	discard	remove redundancy in anti-pattern description regarding skipping COMPUTE and producing essays with invented numbers
2026-03-16T04:46:45	skills	3	.agent/skills/paper_production.md	0.0000	0.0000	+0.0000	discard	remove redundant sub-header numbering in COMPUTE section for clearer structure
2026-03-16T04:46:46	skills	4	.agent/skills/paper_production.md	0	0.0	0	apply_failed	apply failed: remove redundant text about orchestrator delegating content generation
2026-03-16T04:47:37	skills	5	.agent/skills/paper_production.md	0	0.0	0	apply_failed	apply failed: simplify overly detailed anti-pattern listing by removing redundancy about direct orchestrator behavior
2026-03-16T04:47:38	skills	6	.agent/skills/paper_production.md	0	0.0	0	apply_failed	apply failed: remove redundant anti-pattern about skipping COMPUTE to simplify and clarify list
2026-03-16T04:47:40	skills	7	.agent/skills/paper_production.md	0	0.0	0	apply_failed	apply failed: remove redundancy regarding the mandatory nature of COMPUTE in paper production
2026-03-16T04:47:41	skills	8	.agent/skills/paper_production.md	0.0000	0.0000	+0.0000	discard	simplify explanation of orchestrator's role in SDD flow
2026-03-16T04:47:42	skills	9	.agent/skills/paper_production.md	0	0.0	0	apply_failed	apply failed: simplify explanation in 'COMPUTE' to improve clarity and focus
2026-03-16T04:47:44	skills	10	.agent/skills/paper_production.md	0	0.0	0	apply_failed	apply failed: refine structural rule about maximum semicolon usage for clarity
2026-03-17T04:25:37	skills	1	.agent/skills/signal_processing.md	0.0000	0.0000	+0.0000	discard	clarify the roles of Q and R in the 'SSOT for Kalman parameters' section for improved understanding
2026-03-17T04:25:55	skills	2	.agent/skills/signal_processing.md	0.0000	0.0000	+0.0000	discard	remove redundancy in the explanation of the Verifier integration step to improve clarity
2026-03-17T04:25:58	skills	3	.agent/skills/signal_processing.md	0.0000	0.0000	+0.0000	discard	simplify explanation of Q and R to improve clarity
2026-03-17T04:26:00	skills	4	.agent/skills/signal_processing.md	0.0000	0.0000	+0.0000	discard	clarify Verifier integration Step 7 requirements for better structure and completeness
2026-03-17T04:26:07	skills	5	.agent/skills/signal_processing.md	0.0000	0.0000	+0.0000	discard	simplify critical pattern by clarifying when to use Kalman vs Buffer
2026-03-17T04:26:09	skills	6	.agent/skills/signal_processing.md	0.0000	0.0000	+0.0000	discard	simplify explanation of 'SSOT for Kalman parameters' for clarity
2026-03-17T04:26:16	skills	7	.agent/skills/signal_processing.md	0.0000	0.0000	+0.0000	discard	clarify SSOT rule to specify why hardcoding is problematic and what issues it avoids
2026-03-17T04:26:19	skills	8	.agent/skills/signal_processing.md	0.0000	0.0000	+0.0000	discard	Clarify meaning of Q and R parameters in Kalman filter
2026-03-17T04:26:22	skills	9	.agent/skills/signal_processing.md	0.0000	0.0000	+0.0000	discard	clarify the importance of Kalman integration by emphasizing phase lag impact
2026-03-17T04:26:28	skills	10	.agent/skills/signal_processing.md	0.0000	0.0000	+0.0000	discard	simplify explanation of Kalman vs Buffer pattern to improve clarity and focus
2026-03-18T04:30:57	validator	1	tools/validate_submission.py	0.6667	0.6667	+0.0000	discard	Remove re.IGNORECASE flag from RSN detection regex to improve case-sensitive detection accuracy.
2026-03-18T04:31:14	validator	2	tools/validate_submission.py	0.6667	0.6667	+0.0000	discard	Remove re.IGNORECASE flag from AI_BLACKLISTED_PHRASES checks to improve precision
2026-03-18T04:31:16	validator	3	tools/validate_submission.py	0.6667	0.6667	+0.0000	discard	Remove re.IGNORECASE flag for RSN regex to reduce false positives
2026-03-18T04:31:19	validator	4	tools/validate_submission.py	0.6667	0.6667	+0.0000	discard	Remove re.IGNORECASE flag in RSN detection to improve case-sensitive precision and reduce false positives
2026-03-18T04:31:21	validator	5	tools/validate_submission.py	0.6667	0.6667	+0.0000	discard	Remove re.IGNORECASE flag from RSN regex to reduce false positives
2026-03-18T04:31:23	validator	6	tools/validate_submission.py	0.6667	0.6667	+0.0000	discard	Remove re.IGNORECASE flag from RSN detection to reduce false positives
2026-03-18T04:31:26	validator	7	tools/validate_submission.py	0.6667	0.6667	+0.0000	discard	Remove re.IGNORECASE flag from RSN pattern matching to potentially reduce false positives
2026-03-18T04:32:14	validator	8	tools/validate_submission.py	0.6667	0.6667	+0.0000	discard	Remove re.IGNORECASE from RSN detection to reduce false positives based on recent failed experiments.
2026-03-18T04:32:16	validator	9	tools/validate_submission.py	0.6667	0.6667	+0.0000	discard	Remove re.IGNORECASE flag from RSN pattern matching to improve specificity
2026-03-18T04:32:19	validator	10	tools/validate_submission.py	0.6667	0.6667	+0.0000	discard	Restrict RSN pattern matching to case-sensitive to reduce false positives.
2026-03-19T04:29:55	prompts	1	.agent/prompts/physical_critic.md	0.0000	0.0000	+0.0000	discard	simplify `Dominio water (FEniCSx)` checklist to remove redundant detail
2026-03-19T04:30:15	prompts	2		0	0.0	0	error	proposal error: Could not parse proposal: \n⚠️ PHYSICAL CRITIC ALERT\nModo de fallo detectado: [pandeo | torsión | i
2026-03-19T04:30:18	prompts	3	.agent/prompts/physical_critic.md	0.0000	0.0000	+0.0000	discard	simplify 'Checklist de Fallos a Inspeccionar' section header for brevity
2026-03-19T04:30:19	prompts	4	.agent/prompts/physical_critic.md	0.0000	0.0000	+0.0000	discard	simplify instruction on `mem_save` step for better clarity
2026-03-19T04:30:21	prompts	5	.agent/prompts/physical_critic.md	0.0000	0.0000	+0.0000	discard	simplify the activation condition related to structural modifications for clarity
2026-03-19T04:30:23	prompts	6	.agent/prompts/physical_critic.md	0.0000	0.0000	+0.0000	discard	clarify activation condition for seismic load action
2026-03-19T04:31:14	prompts	7	.agent/prompts/physical_critic.md	0.0000	0.0000	+0.0000	discard	simplify activation condition for structural geometry changes
2026-03-19T04:31:16	prompts	8		0	0.0	0	error	proposal error: Could not parse proposal: \n⚠️ PHYSICAL CRITIC ALERT\nModo de fallo detectado: [pandeo | torsión | i
2026-03-19T04:31:18	prompts	9	.agent/prompts/physical_critic.md	0.0000	0.0000	+0.0000	discard	simplify wording for activation conditions related to border changes
2026-03-19T04:31:20	prompts	10		0	0.0	0	error	proposal error: Could not parse proposal: \n⚠️ PHYSICAL CRITIC ALERT\nModo de fallo detectado: [pandeo | torsión | i
2026-03-21T04:12:06	prompts	1	.agent/prompts/verifier.md	0.0000	0.0000	+0.0000	discard	simplify wording in the hash integrity check to improve clarity and focus
2026-03-21T04:12:10	prompts	2	.agent/prompts/verifier.md	0.0000	0.0000	+0.0000	discard	clarify and simplify hash mismatch handling in PASO 0
2026-03-21T04:12:13	prompts	3	.agent/prompts/verifier.md	0.0000	0.0000	+0.0000	discard	simplify and clarify the reporting structure for computational efficiency
2026-03-21T04:13:00	prompts	4	.agent/prompts/verifier.md	0.0000	0.0000	+0.0000	discard	simplify and clarify the `Regla de Oro del Verifier` for conciseness
2026-03-21T04:13:02	prompts	5	.agent/prompts/verifier.md	0	0.0	0	apply_failed	apply failed: simplify guidance for SSOT_HASH failure action
2026-03-21T04:13:05	prompts	6	.agent/prompts/verifier.md	0.0000	0.0000	+0.0000	discard	clarify the condition of stopping pipeline in case hashes do not match
2026-03-21T04:13:07	prompts	7	.agent/prompts/verifier.md	0.0000	0.0000	+0.0000	discard	clarify the consequence of missing hash sync step in PASO 0
2026-03-21T04:13:10	prompts	8	.agent/prompts/verifier.md	0.0000	0.0000	+0.0000	discard	simplify wording for SSOT_HASH check instructions to improve clarity
2026-03-21T04:13:13	prompts	9	.agent/prompts/verifier.md	0.0000	0.0000	+0.0000	discard	clarify the error action in step 0 for hash mismatch
2026-03-21T04:13:16	prompts	10	.agent/prompts/verifier.md	0.0000	0.0000	+0.0000	discard	simplify wording for clearer activation conditions
2026-03-22T04:27:04	simulation	1	src/physics/torture_chamber.py	0.0000	0.0000	+0.0000	discard	Replace generic exception handling with specific error handling in ops.reactions block to improve robustness.
2026-03-22T04:27:44	simulation	2	src/physics/torture_chamber.py	0.0000	0.0000	+0.0000	discard	fix potential crash if opensees reactions fail by capturing exception
2026-03-22T04:27:46	simulation	3	src/physics/torture_chamber.py	0	0.0	0	apply_failed	apply failed: Simplify exception handling in step and improve numerical accuracy for stress calculation
2026-03-22T04:27:47	simulation	4	src/physics/torture_chamber.py	0.0000	0.0000	+0.0000	discard	simplify error handling in the `step` method by removing unnecessary try-except block
2026-03-22T04:27:49	simulation	5	src/physics/torture_chamber.py	0.0000	0.0000	+0.0000	discard	handle edge case for missing keys in nested config lookup
2026-03-22T04:27:51	simulation	6	src/physics/torture_chamber.py	0.0000	0.0000	+0.0000	discard	Add exception handling to ops.reactions() to avoid potential crashes.
2026-03-22T04:27:53	simulation	7	src/physics/torture_chamber.py	0	0.0	0	apply_failed	apply failed: Simplify exception handling in StructuralBackend.step method to ensure robustness and raise precise errors
2026-03-22T04:27:56	simulation	8	src/physics/torture_chamber.py	0.0000	0.0000	+0.0000	discard	Add error handling for potential exceptions during 'ops.reactions()' and 'ops.nodeReaction' calls in 'step' method.
2026-03-22T04:28:45	simulation	9	src/physics/torture_chamber.py	0.0000	0.0000	+0.0000	discard	remove redundant exception handling in step method
2026-03-22T04:28:47	simulation	10	src/physics/torture_chamber.py	0.0000	0.0000	+0.0000	discard	add try-except block to handle potential errors when loading SSOT configuration
2026-03-24T04:26:32	simulation	1	src/physics/spectral_engine.py	0.0000	0.0000	+0.0000	discard	Replace redundant inline comment with clearer explanatory comment on Newmark β method integration
2026-03-24T04:26:35	simulation	2	src/physics/spectral_engine.py	0	0.0	0	apply_failed	apply failed: remove redundant sys.path modification
2026-03-24T04:26:36	simulation	3	src/physics/spectral_engine.py	0	0.0	0	apply_failed	apply failed: Replace redundant insertion of project root path with a safer check to avoid duplicates.
2026-03-24T04:26:38	simulation	4	src/physics/spectral_engine.py	0.0000	0.0000	+0.0000	discard	replace default T_range initialization with np.arange for consistent interval spacing
2026-03-24T04:27:28	simulation	5	src/physics/spectral_engine.py	0.0	0.0	0	skip	skip — no useful change found
2026-03-24T04:27:29	simulation	6	src/physics/spectral_engine.py	0.0000	0.0000	+0.0000	discard	replace explicit default of T_range with a default np.linspace initialization
2026-03-24T04:27:31	simulation	7	src/physics/spectral_engine.py	0.0000	0.0000	+0.0000	discard	Ensure T_range is a numpy array to avoid type-related issues.
2026-03-24T04:27:32	simulation	8	src/physics/spectral_engine.py	0.0000	0.0000	+0.0000	discard	Replace hardcoded gravitational acceleration constant with a named constant for clarity and consistency
2026-03-24T04:27:34	simulation	9	src/physics/spectral_engine.py	0.0000	0.0000	+0.0000	discard	simplify default T_range assignment to improve readability and maintainability
2026-03-24T04:27:37	simulation	10	src/physics/spectral_engine.py	0.0000	0.0000	+0.0000	discard	simplify default T_range assignment by directly initializing numpy array
2026-03-25T04:27:50	skills	1	.agent/skills/paper_production.md	0.0000	0.0000	+0.0000	discard	simplify section to improve clarity by removing redundant detail about sub-agent prompt sizes
2026-03-25T04:28:07	skills	2	.agent/skills/paper_production.md	0.0000	0.0000	+0.0000	discard	clarify that a paper without COMPUTE results in unreliable outcomes by emphasizing the importance of real data
2026-03-25T04:28:10	skills	3	.agent/skills/paper_production.md	0	0.0	0	apply_failed	apply failed: clarify the distinction between 'TASKS' and 'COMPUTE' phases
2026-03-25T04:28:12	skills	4	.agent/skills/paper_production.md	0	0.0	0	apply_failed	apply failed: simplify tone guideline for directness
2026-03-25T04:28:14	skills	5	.agent/skills/paper_production.md	0.0000	0.0000	+0.0000	discard	clarify language explaining sequential order of sub-phases in COMPUTE to improve skill clarity
2026-03-25T04:28:16	skills	6	.agent/skills/paper_production.md	0	0.0	0	apply_failed	apply failed: remove redundant example to improve clarity under BAD vs GOOD Examples
2026-03-25T04:28:18	skills	7	.agent/skills/paper_production.md	0	0.0	0	apply_failed	apply failed: simplify explanation of SDD Flow by combining relevant points and removing redundant details
2026-03-25T04:28:21	skills	8	.agent/skills/paper_production.md	0.0000	0.0000	+0.0000	discard	clarify SSOT reference to improve skill clarity and specificity
2026-03-25T04:29:07	skills	9	.agent/skills/paper_production.md	0	0.0	0	apply_failed	apply failed: remove redundant guidance on 'specs and design phases running in parallel'
2026-03-25T04:29:08	skills	10	.agent/skills/paper_production.md	0.0000	0.0000	+0.0000	discard	remove redundant word in TASKS section for clarity
2026-03-26T04:40:09	validator	1	tools/validate_submission.py	0.6667	0.6667	+0.0000	discard	Remove re.IGNORECASE from RSN detection to reduce false positives.
2026-03-26T04:40:12	validator	2	tools/validate_submission.py	0	0.6667	0	apply_failed	apply failed: Remove re.IGNORECASE from RSN detection to reduce false positives
2026-03-26T04:40:14	validator	3	tools/validate_submission.py	0	0.6667	0	apply_failed	apply failed: Remove re.IGNORECASE from RSN detection to reduce false positives caused by case-insensitive matches.
2026-03-26T04:40:15	validator	4	tools/validate_submission.py	0.6667	0.6667	+0.0000	discard	Restrict RSN detection to non-case-insensitive by removing re.IGNORECASE, reducing false positives.
2026-03-26T04:40:17	validator	5	tools/validate_submission.py	0.6667	0.6667	+0.0000	discard	Remove re.IGNORECASE from RSN detection to reduce false positives
2026-03-26T04:40:19	validator	6	tools/validate_submission.py	0.6667	0.6667	+0.0000	discard	Remove re.IGNORECASE flag from RSN detection to reduce false positives.
2026-03-26T04:41:13	validator	7	tools/validate_submission.py	0.6667	0.6667	+0.0000	discard	Remove re.IGNORECASE flag from RSN detection to reduce false positives
2026-03-26T04:41:15	validator	8	tools/validate_submission.py	0.6667	0.6667	+0.0000	discard	Remove re.IGNORECASE from RSN detection regex to reduce false positives.
2026-03-26T04:41:17	validator	9	tools/validate_submission.py	0.6667	0.6667	+0.0000	discard	Remove re.IGNORECASE flag from RSN detection to reduce false positives
2026-03-26T04:41:19	validator	10	tools/validate_submission.py	0.6667	0.6667	+0.0000	discard	Remove re.IGNORECASE flag for RSN detection to reduce false positives
2026-03-27T04:40:39	skills	1	.agent/skills/signal_processing.md	0.0000	0.0000	+0.0000	discard	simplify and combine explanations for Q and R parameters under SSOT for clarity
2026-03-27T04:41:12	skills	2	.agent/skills/signal_processing.md	0.0000	0.0000	+0.0000	discard	clarify example in Kalman filter usage by explicitly naming accel_filtered argument
2026-03-27T04:41:14	skills	3	.agent/skills/signal_processing.md	0.0000	0.0000	+0.0000	discard	simplify description of Verifier integration (STEP 7) for clarity
2026-03-27T04:41:16	skills	4	.agent/skills/signal_processing.md	0.0000	0.0000	+0.0000	discard	clarify Kalman filter innovation sequence explanation for spike classification
2026-03-27T04:41:18	skills	5	.agent/skills/signal_processing.md	0.0000	0.0000	+0.0000	discard	clarify the consequences of using a moving-average buffer over a Kalman filter
2026-03-27T04:41:20	skills	6	.agent/skills/signal_processing.md	0.0000	0.0000	+0.0000	discard	add clarity to SSOT for Kalman parameters section by explicitly stating what SSOT means
2026-03-27T04:41:22	skills	7	.agent/skills/signal_processing.md	0.0000	0.0000	+0.0000	discard	clarify role of Q and R parameters in SSOT section
2026-03-27T04:41:24	skills	8	.agent/skills/signal_processing.md	0.0000	0.0000	+0.0000	discard	clarify anti-pattern about aborting on single spike by emphasizing the need for multiple observations
2026-03-27T04:41:26	skills	9	.agent/skills/signal_processing.md	0.0000	0.0000	+0.0000	discard	clarified the innovation sequence explanation for better precision and completeness
