timestamp	room	experiment	file_changed	score	baseline	delta	status	description
2026-03-27T04:41:28	skills	10	.agent/skills/signal_processing.md	0.0000	0.0000	+0.0000	discard	clarify SSOT for Kalman parameters by explicitly defining acronym when first introduced
2026-03-28T04:27:40	prompts	1	.agent/prompts/physical_critic.md	0.0000	0.0000	+0.0000	discard	simplify checklist item to reduce scope for clearer focus
2026-03-28T04:27:42	prompts	2	.agent/prompts/physical_critic.md	0.0000	0.0000	+0.0000	discard	simplify activation conditions for clarity
2026-03-28T04:27:44	prompts	3	.agent/prompts/physical_critic.md	0.0000	0.0000	+0.0000	discard	simplify activation conditions to improve clarity
2026-03-28T04:27:46	prompts	4	.agent/prompts/physical_critic.md	0.0000	0.0000	+0.0000	discard	simplify activation condition for modifications in geometry
2026-03-28T04:28:31	prompts	5	.agent/prompts/physical_critic.md	0.0000	0.0000	+0.0000	discard	simplify and clarify the protocol for saving results in Engram Bus step
2026-03-28T04:28:33	prompts	6	.agent/prompts/physical_critic.md	0.0000	0.0000	+0.0000	discard	simplify activation condition wording for clarity
2026-03-28T04:28:35	prompts	7	.agent/prompts/physical_critic.md	0.0000	0.0000	+0.0000	discard	simplify activation condition list for clarity and brevity
2026-03-28T04:28:37	prompts	8	.agent/prompts/physical_critic.md	0.0000	0.0000	+0.0000	discard	simplify activation conditions for clarity
2026-03-28T04:28:39	prompts	9	.agent/prompts/physical_critic.md	0.0000	0.0000	+0.0000	discard	simplify the activation condition for edge modifications to reduce ambiguity
2026-03-28T04:28:40	prompts	10	.agent/prompts/physical_critic.md	0.0000	0.0000	+0.0000	discard	simplify recommendation output format for clarity
2026-03-29T04:43:42	quartile_gates	1	tools/validate_submission.py	0	0.6	0	apply_failed	apply failed: remove redundant check for blacklisted AI phrases to streamline validation
2026-03-29T04:43:45	quartile_gates	2	tools/validate_submission.py	0	0.6	0	apply_failed	apply failed: Enforce per-quartile validation for Q1 sections to improve quartile_accuracy.
2026-03-29T04:44:32	quartile_gates	3	tools/validate_submission.py	0.0000	0.6000	-0.6000	crash	Improve per-quartile validation by enforcing Q1 required sections
2026-03-29T04:44:35	quartile_gates	4	tools/validate_submission.py	0	0.6	0	apply_failed	apply failed: Remove unused exception handling for yaml import to simplify code.
2026-03-29T04:44:38	quartile_gates	5	tools/validate_submission.py	0	0.6	0	apply_failed	apply failed: Enforce Q1 section flag in quartile validation to improve accuracy.
2026-03-29T04:44:40	quartile_gates	6	tools/validate_submission.py	0.6	0.6	0	skip	skip — no useful change found
2026-03-29T04:44:42	quartile_gates	7	tools/validate_submission.py	0	0.6	0	apply_failed	apply failed: Refine error handling to prevent false negatives by ensuring Q1 references and sections are both flagged.
2026-03-29T04:44:45	quartile_gates	8	tools/validate_submission.py	0	0.6	0	apply_failed	apply failed: Remove unnecessary variable initialization 'all_pass = True' as it's overwritten immediately in the loop
2026-03-29T04:44:48	quartile_gates	9	tools/validate_submission.py	0	0.6	0	apply_failed	apply failed: Fix missing Q1 sections check for improved validation accuracy.
2026-03-29T04:44:50	quartile_gates	10	tools/validate_submission.py	0	0.6	0	apply_failed	apply failed: Ensure Q1 sections are validated by enforcing required sections flagging.
2026-03-30T04:51:57	simulation	1	src/physics/torture_chamber.py	0.0000	0.0000	+0.0000	discard	remove redundant sys.path.append as imports already use relative paths
2026-03-30T04:52:01	simulation	2	src/physics/torture_chamber.py	0.0000	0.0000	+0.0000	discard	remove unused 'mass_kg' default value in the 'step' method to simplify code
2026-03-30T04:52:03	simulation	3	src/physics/torture_chamber.py	0	0.0	0	apply_failed	apply failed: simplify exception handling in 'stress_pa' computation to avoid zero masking
2026-03-30T04:52:06	simulation	4	src/physics/torture_chamber.py	0.0000	0.0000	+0.0000	discard	Simplify check for required nonlinear parameters using all()
2026-03-30T04:52:56	simulation	5	src/physics/torture_chamber.py	0	0.0	0	apply_failed	apply failed: remove redundant sys.path modification which isn't directly used
2026-03-30T04:52:57	simulation	6	src/physics/torture_chamber.py	0	0.0	0	apply_failed	apply failed: Remove redundant check for None in _nonlinear_ready function
2026-03-30T04:52:59	simulation	7	src/physics/torture_chamber.py	0	0.0	0	apply_failed	apply failed: Add error handling to improve robustness during stress_pa computation.
2026-03-30T04:53:01	simulation	8	src/physics/torture_chamber.py	0	0.0	0	apply_failed	apply failed: remove redundant error handling in the step method
2026-03-30T04:53:03	simulation	9	src/physics/torture_chamber.py	0	0.0	0	apply_failed	apply failed: remove unused import for math library
2026-03-30T04:53:04	simulation	10	src/physics/torture_chamber.py	0.0000	0.0000	+0.0000	discard	Simplify variable initialization by removing redundant computation.
2026-03-31T04:42:56	simulation	1	src/physics/spectral_engine.py	0	0.0	0	apply_failed	apply failed: Remove redundant sys.path insertion for ROOT directory.
2026-03-31T04:42:58	simulation	2	src/physics/spectral_engine.py	0	0.0	0	apply_failed	apply failed: Remove redundant sys.path insertion since the script already resolves ROOT dynamically.
2026-03-31T04:43:00	simulation	3	src/physics/spectral_engine.py	0	0.0	0	apply_failed	apply failed: remove redundant sys.path modification for ROOT as it is unnecessary
2026-03-31T04:43:45	simulation	4	src/physics/spectral_engine.py	0	0.0	0	apply_failed	apply failed: Remove unused import for the sys library to improve code quality.
2026-03-31T04:43:47	simulation	5	src/physics/spectral_engine.py	0.0000	0.0000	+0.0000	discard	Simplify T_range initialization logic in compute_spectral_response to improve numerical clarity
2026-03-31T04:43:49	simulation	6	src/physics/spectral_engine.py	0	0.0	0	apply_failed	apply failed: remove unused import for sys library
2026-03-31T04:43:51	simulation	7	src/physics/spectral_engine.py	0	0.0	0	apply_failed	apply failed: remove redundant sys.path modification since ROOT is unused
2026-03-31T04:43:52	simulation	8	src/physics/spectral_engine.py	0	0.0	0	apply_failed	apply failed: remove unnecessary sys.path modification to simplify imports and improve robustness
2026-03-31T04:43:54	simulation	9	src/physics/spectral_engine.py	0	0.0	0	apply_failed	apply failed: replace hardcoded damping constant ζ=0.05 with function input
2026-03-31T04:43:57	simulation	10	src/physics/spectral_engine.py	0	0.0	0	apply_failed	apply failed: Remove unused import for Pathlib to simplify and improve code quality
2026-04-01T04:53:19	validator	1	tools/validate_submission.py	0.6667	0.6667	+0.0000	discard	Remove re.IGNORECASE from RSN detection regex to reduce false positives.
2026-04-01T04:53:22	validator	2	tools/validate_submission.py	0.6667	0.6667	+0.0000	discard	Remove redundant re.IGNORECASE flag in RSN detection regex for minimal improvement in precision
2026-04-01T04:54:09	validator	3	tools/validate_submission.py	0.6667	0.6667	+0.0000	discard	Remove re.IGNORECASE flag for RSN detection to tighten matching criteria.
2026-04-01T04:54:11	validator	4	tools/validate_submission.py	0.6667	0.6667	+0.0000	discard	remove re.IGNORECASE flag from RSN detection regex to reduce false positives
2026-04-01T04:54:14	validator	5	tools/validate_submission.py	0.6667	0.6667	+0.0000	discard	Remove re.IGNORECASE from RSN detection regex to reduce false positives
2026-04-01T04:54:16	validator	6	tools/validate_submission.py	0.6667	0.6667	+0.0000	discard	simplify RSN detection by removing re.IGNORECASE flag
2026-04-01T04:54:18	validator	7	tools/validate_submission.py	0.6667	0.6667	+0.0000	discard	Remove re.IGNORECASE from RSN regex in suggest_traceability to potentially reduce false positives.
2026-04-01T04:54:21	validator	8	tools/validate_submission.py	0.6667	0.6667	+0.0000	discard	Remove re.IGNORECASE flag from RSN detection to reduce false positives.
2026-04-01T04:54:23	validator	9	tools/validate_submission.py	0.6667	0.6667	+0.0000	discard	Remove re.IGNORECASE flag from RSN detection regex to reduce potential false positives.
2026-04-01T04:54:25	validator	10	tools/validate_submission.py	0.6667	0.6667	+0.0000	discard	Remove `re.IGNORECASE` from RSN regex in `suggest_traceability` to reduce false positives.
2026-04-02T04:37:14	skills	1	.agent/skills/paper_production.md	0.0000	0.0000	+0.0000	discard	clarify structure by numbering Critical Patterns subsections
2026-04-02T04:37:47	skills	2	.agent/skills/paper_production.md	0	0.0	0	apply_failed	apply failed: clarify 'COMPUTE runs AFTER TASKS and BEFORE IMPLEMENT' section for completeness
2026-04-02T04:37:49	skills	3	.agent/skills/paper_production.md	0	0.0	0	apply_failed	apply failed: delete redundant heading 'Skill: Paper Production Pipeline' for improved structure
2026-04-02T04:37:51	skills	4	.agent/skills/paper_production.md	0.0000	0.0000	+0.0000	discard	remove redundant mention of SSOT as it's already defined elsewhere
2026-04-02T04:37:52	skills	5	.agent/skills/paper_production.md	0	0.0	0	apply_failed	apply failed: clarify EXPLORE phase by explicitly stating purpose
2026-04-02T04:37:55	skills	6	.agent/skills/paper_production.md	0.0000	0.0000	+0.0000	discard	simplify redundancy in bad phrase examples
2026-04-02T04:37:56	skills	7	.agent/skills/paper_production.md	0.0000	0.0000	+0.0000	discard	remove duplicate numbering for Task 5.5 and give it a unique number
2026-04-02T04:37:58	skills	8	.agent/skills/paper_production.md	0	0.0	0	apply_failed	apply failed: combine redundant phrasing in Critical Patterns SDD Flow section for clarity
2026-04-02T04:38:00	skills	9	.agent/skills/paper_production.md	0	0.0	0	apply_failed	apply failed: clarify and expand COMPUTE's role to improve skill clarity
2026-04-02T04:38:02	skills	10	.agent/skills/paper_production.md	0.0000	0.0000	+0.0000	discard	clarify and simplify the FUNDAMENTAL RULE in SDD Flow for Papers
2026-04-03T04:37:24	prompts	1	.agent/prompts/verifier.md	0.0000	0.0000	+0.0000	discard	simplify the description of the activation condition list for clarity and conciseness
2026-04-03T04:37:27	prompts	2	.agent/prompts/verifier.md	0.0000	0.0000	+0.0000	discard	simplify step to enhance clarity—remove redundancy in hash comparison step
2026-04-03T04:37:29	prompts	3	.agent/prompts/verifier.md	0.0000	0.0000	+0.0000	discard	simplify activation condition wording for clarity
2026-04-03T04:38:16	prompts	4	.agent/prompts/verifier.md	0.0000	0.0000	+0.0000	discard	simplify SSOT mismatch resolution steps for clarity and brevity
2026-04-03T04:38:18	prompts	5	.agent/prompts/verifier.md	0.0000	0.0000	+0.0000	discard	simplify wording in the 'Regla de Oro del Verifier' for clarity and brevity
2026-04-03T04:38:20	prompts	6	.agent/prompts/verifier.md	0.0000	0.0000	+0.0000	discard	simplify and clarify the hash check procedure in PASO 0
2026-04-03T04:38:23	prompts	7	.agent/prompts/verifier.md	0.0000	0.0000	+0.0000	discard	simplify rule for checking empty sensor data files for better clarity
2026-04-03T04:38:25	prompts	8	.agent/prompts/verifier.md	0.0000	0.0000	+0.0000	discard	Simplify and clarify the rule of thumb for when to block the pipeline.
2026-04-03T04:38:27	prompts	9	.agent/prompts/verifier.md	0.0000	0.0000	+0.0000	discard	simplify activation condition to enhance clarity and effectiveness
2026-04-03T04:38:29	prompts	10	.agent/prompts/verifier.md	0.0000	0.0000	+0.0000	discard	clarify step in PASO 0 for hash mismatch actions
2026-04-04T04:24:57	skills	1	.agent/skills/signal_processing.md	0.0000	0.0000	+0.0000	discard	simplify SSOT instructions for clarity
2026-04-04T04:24:59	skills	2	.agent/skills/signal_processing.md	0.0000	0.0000	+0.0000	discard	simplify description of Verifier integration STEP 7 for clarity
2026-04-04T04:25:01	skills	3	.agent/skills/signal_processing.md	0.0000	0.0000	+0.0000	discard	clarify Verifier's role by simplifying STEP 7 explanation
2026-04-04T04:25:03	skills	4	.agent/skills/signal_processing.md	0.0000	0.0000	+0.0000	discard	clarify the distinction between normal innovation distribution and persistent bias in innovation for signal classification
2026-04-04T04:25:47	skills	5	.agent/skills/signal_processing.md	0.0000	0.0000	+0.0000	discard	clarify 'STEP 7 — Estimator Variance' to improve completeness
2026-04-04T04:25:49	skills	6	.agent/skills/signal_processing.md	0.0000	0.0000	+0.0000	discard	clarify the purpose of Verifier in STEP 7 to improve coverage
2026-04-04T04:25:51	skills	7	.agent/skills/signal_processing.md	0.0000	0.0000	+0.0000	discard	clarify Verifier's role in auditing by simplifying STEP 7 explanation
2026-04-04T04:25:53	skills	8	.agent/skills/signal_processing.md	0.0000	0.0000	+0.0000	discard	simplify Anti-Pattern about aborting on a single spike to improve clarity
2026-04-04T04:25:55	skills	9	.agent/skills/signal_processing.md	0.0000	0.0000	+0.0000	discard	simplify and clarify anti-pattern description for buffer usage
2026-04-04T04:25:57	skills	10	.agent/skills/signal_processing.md	0.0000	0.0000	+0.0000	discard	simplify Kalman parameter explanation for clarity
2026-04-05T04:44:02	simulation	1	src/physics/torture_chamber.py	0	0.0	0	apply_failed	apply failed: remove unused sys.path modification to simplify imports
2026-04-05T04:44:05	simulation	2	src/physics/torture_chamber.py	0	0.0	0	apply_failed	apply failed: Remove redundant import for sys library
2026-04-05T04:44:50	simulation	3	src/physics/torture_chamber.py	0	0.0	0	apply_failed	apply failed: simplify imports by removing unused 'sys' and 'Path' modules
2026-04-05T04:44:52	simulation	4	src/physics/torture_chamber.py	0	0.0	0	apply_failed	apply failed: remove redundant sys.path modification to simplify imports
2026-04-05T04:44:53	simulation	5	src/physics/torture_chamber.py	0	0.0	0	apply_failed	apply failed: remove unnecessary sys.path modification to simplify imports
2026-04-05T04:44:55	simulation	6	src/physics/torture_chamber.py	0.0000	0.0000	+0.0000	discard	remove unused import for sys library to simplify and improve code quality
2026-04-05T04:44:57	simulation	7	src/physics/torture_chamber.py	0	0.0	0	apply_failed	apply failed: remove unnecessary sys.path modification to simplify imports and improve code quality
2026-04-05T04:44:58	simulation	8	src/physics/torture_chamber.py	0	0.0	0	apply_failed	apply failed: remove unused import for sys library
2026-04-05T04:45:00	simulation	9	src/physics/torture_chamber.py	0.0000	0.0000	+0.0000	discard	remove unused import for Pathlib to simplify and improve code quality
2026-04-05T04:45:01	simulation	10	src/physics/torture_chamber.py	0	0.0	0	apply_failed	apply failed: remove redundant sys.path modification to simplify imports
2026-04-06T04:51:32	simulation	1	src/physics/spectral_engine.py	0	0.0	0	apply_failed	apply failed: remove unnecessary sys.path modification
2026-04-06T04:52:14	simulation	2	src/physics/spectral_engine.py	0	0.0	0	apply_failed	apply failed: Remove the sys.path modification to simplify the code and improve robustness.
2026-04-06T04:52:16	simulation	3	src/physics/spectral_engine.py	0	0.0	0	apply_failed	apply failed: Remove redundant sys.path modification to simplify imports
2026-04-06T04:52:17	simulation	4	src/physics/spectral_engine.py	0	0.0	0	apply_failed	apply failed: remove unnecessary sys.path modification which is redundant and error-prone
2026-04-06T04:52:19	simulation	5	src/physics/spectral_engine.py	0	0.0	0	apply_failed	apply failed: remove unused import for sys library to improve code simplicity
2026-04-06T04:52:21	simulation	6	src/physics/spectral_engine.py	0	0.0	0	apply_failed	apply failed: remove unused and redundant sys.path modification to improve code quality
2026-04-06T04:52:22	simulation	7	src/physics/spectral_engine.py	0	0.0	0	apply_failed	apply failed: remove unnecessary sys.path modification to simplify imports
2026-04-06T04:52:24	simulation	8	src/physics/spectral_engine.py	0	0.0	0	apply_failed	apply failed: remove unused import for sys library to simplify and improve code quality
2026-04-06T04:52:26	simulation	9	src/physics/spectral_engine.py	0	0.0	0	apply_failed	apply failed: remove unnecessary sys.path modification at the start of the script
2026-04-06T04:52:28	simulation	10	src/physics/spectral_engine.py	0	0.0	0	apply_failed	apply failed: remove unnecessary sys.path modification to simplify imports
2026-04-07T04:41:10	validator	1	tools/validate_submission.py	0.6667	0.6667	+0.0000	discard	Remove re.IGNORECASE from RSN detection to reduce false positives
2026-04-07T04:41:29	validator	2	tools/validate_submission.py	0.6667	0.6667	+0.0000	discard	remove re.IGNORECASE from RSN detection to potentially reduce false positives
2026-04-07T04:41:31	validator	3	tools/validate_submission.py	0.6667	0.6667	+0.0000	discard	remove re.IGNORECASE flag from RSN detection to reduce false positives.
2026-04-07T04:41:33	validator	4	tools/validate_submission.py	0.6667	0.6667	+0.0000	discard	remove `re.IGNORECASE` for RSN detection in `suggest_traceability` to reduce false positives
2026-04-07T04:41:36	validator	5	tools/validate_submission.py	0.6667	0.6667	+0.0000	discard	remove re.IGNORECASE from RSN regex in suggest_traceability to potentially improve detection accuracy by reducing false positives
2026-04-07T04:41:38	validator	6	tools/validate_submission.py	0.6667	0.6667	+0.0000	discard	Simplify RSN regex by removing re.IGNORECASE to potentially reduce false positives.
2026-04-07T04:41:40	validator	7	tools/validate_submission.py	0.6667	0.6667	+0.0000	discard	Remove the re.IGNORECASE flag to improve precision in RSN detection.
2026-04-07T04:41:42	validator	8	tools/validate_submission.py	0.6667	0.6667	+0.0000	discard	remove re.IGNORECASE flag from RSN detection regular expression to reduce potential false positives
2026-04-07T04:41:43	validator	9	tools/validate_submission.py	0.6667	0.6667	+0.0000	discard	Remove re.IGNORECASE flag from RSN detection regex to potentially reduce false positives
2026-04-07T04:41:45	validator	10	tools/validate_submission.py	0.6667	0.6667	+0.0000	discard	Remove re.IGNORECASE from RSN detection regex to potentially reduce false positives.
2026-04-08T04:44:27	simulation	1	src/physics/torture_chamber.py	0	0.0	0	apply_failed	apply failed: remove redundant sys.path modification to simplify imports
2026-04-08T04:44:29	simulation	2	src/physics/torture_chamber.py	0	0.0	0	apply_failed	apply failed: remove unused sys.path modification to simplify and improve code clarity
2026-04-08T04:45:09	simulation	3	src/physics/torture_chamber.py	0	0.0	0	apply_failed	apply failed: delete unnecessary sys.path modification for simplification
2026-04-08T04:45:10	simulation	4	src/physics/torture_chamber.py	0	0.0	0	apply_failed	apply failed: Remove unused sys.path modification for potential code quality improvement
2026-04-08T04:45:12	simulation	5	src/physics/torture_chamber.py	0	0.0	0	apply_failed	apply failed: remove unused sys.path modification for simplification
2026-04-08T04:45:14	simulation	6	src/physics/torture_chamber.py	0	0.0	0	apply_failed	apply failed: remove unnecessary 'sys.path.append' for cleaner code
2026-04-08T04:45:15	simulation	7	src/physics/torture_chamber.py	0	0.0	0	apply_failed	apply failed: remove unnecessary sys.path modification to streamline imports
2026-04-08T04:45:16	simulation	8	src/physics/torture_chamber.py	0	0.0	0	apply_failed	apply failed: simplify import by removing unnecessary sys.path modification
2026-04-08T04:45:18	simulation	9	src/physics/torture_chamber.py	0	0.0	0	apply_failed	apply failed: remove unused sys.path modification for cleaner code
2026-04-08T04:45:19	simulation	10	src/physics/torture_chamber.py	0	0.0	0	apply_failed	apply failed: remove unnecessary sys.path modification to simplify imports and avoid potential issues
2026-04-09T04:41:08	prompts	1	.agent/prompts/physical_critic.md	0.0000	0.0000	+0.0000	discard	clarify early alert by specifying exact unit for 'efforts > 0.4·fy'
2026-04-09T04:41:10	prompts	2	.agent/prompts/physical_critic.md	0.0000	0.0000	+0.0000	discard	simplify activation condition description for clarity
2026-04-09T04:41:12	prompts	3	.agent/prompts/physical_critic.md	0.0000	0.0000	+0.0000	discard	simplify the condition for activating when new structural load is proposed
2026-04-09T04:41:13	prompts	4	.agent/prompts/physical_critic.md	0.0000	0.0000	+0.0000	discard	remove redundant phrase to improve clarity in identity/role section
2026-04-09T04:41:16	prompts	5	.agent/prompts/physical_critic.md	0.0000	0.0000	+0.0000	discard	Improve clarity by specifying 'short' in the context of structural height definition
2026-04-09T04:41:17	prompts	6		0	0.0	0	error	proposal error: Could not parse proposal: {
  "file": ".agent/prompts/physical_critic.md",
  "description": "clarify
2026-04-09T04:42:07	prompts	7	.agent/prompts/physical_critic.md	0.0000	0.0000	+0.0000	discard	simplify the activation condition for seismic action to improve clarity
2026-04-09T04:42:11	prompts	8	.agent/prompts/physical_critic.md	0.0000	0.0000	+0.0000	discard	clarify condition of activation regarding edge cases for modified geometries
2026-04-09T04:42:13	prompts	9	.agent/prompts/physical_critic.md	0.0000	0.0000	+0.0000	discard	simplify and clarify the Verificacion de Datos de Excitacion step for improved clarity
2026-04-09T04:42:16	prompts	10	.agent/prompts/physical_critic.md	0.0000	0.0000	+0.0000	discard	simplify activation condition by removing redundant phrasing
2026-04-10T04:53:41	prompts	1	.agent/prompts/verifier.md	0.0000	0.0000	+0.0000	discard	simplify the wording of the rule to improve clarity
2026-04-10T04:53:44	prompts	2	.agent/prompts/verifier.md	0.0000	0.0000	+0.0000	discard	Remove redundant phrasing in the guardrail for yielding to improve clarity.
2026-04-10T04:53:46	prompts	3	.agent/prompts/verifier.md	0.0000	0.0000	+0.0000	discard	simplify the explanation for PASO 0 to increase clarity and conciseness
2026-04-10T04:53:49	prompts	4	.agent/prompts/verifier.md	0.0000	0.0000	+0.0000	discard	Simplify the wording of PASO 0 for better clarity
2026-04-10T04:54:33	prompts	5	.agent/prompts/verifier.md	0.0000	0.0000	+0.0000	discard	simplify the integration check for SSOT to improve clarity by grouping the actions
2026-04-10T04:54:36	prompts	6	.agent/prompts/verifier.md	0.0000	0.0000	+0.0000	discard	clarify action in case of SSOT hash mismatch in PASO 0
2026-04-10T04:54:39	prompts	7	.agent/prompts/verifier.md	0.0000	0.0000	+0.0000	discard	clarify the criticality of the first step in PASO 0 for beginners
2026-04-10T04:54:41	prompts	8	.agent/prompts/verifier.md	0.0000	0.0000	+0.0000	discard	simplify and clarify the condition for PASO 0 to improve clarity
2026-04-10T04:54:44	prompts	9	.agent/prompts/verifier.md	0	0.0	0	apply_failed	apply failed: simplify activation conditions for verifier
2026-04-10T04:54:46	prompts	10	.agent/prompts/verifier.md	0.0000	0.0000	+0.0000	discard	simplify activation condition by removing redundant phrasing
2026-04-11T04:28:17	prompts	1	.agent/prompts/physical_critic.md	0.0000	0.0000	+0.0000	discard	Simplify the Engram Bus activation steps by removing redundant phrasing for clarity.
2026-04-11T04:28:19	prompts	2	.agent/prompts/physical_critic.md	0.0000	0.0000	+0.0000	discard	simplify activation conditions by consolidating bullet points for clarity
2026-04-11T04:28:21	prompts	3	.agent/prompts/physical_critic.md	0.0000	0.0000	+0.0000	discard	simplify checklist item related to pressure convergence for water domain to improve clarity
2026-04-11T04:29:09	prompts	4	.agent/prompts/physical_critic.md	0.0000	0.0000	+0.0000	discard	simplify activation condition by removing redundant phrasing
2026-04-11T04:29:10	prompts	5		0	0.0	0	error	proposal error: Could not parse proposal: \n⚠️ PHYSICAL CRITIC ALERT\nModo de fallo detectado: [pandeo | torsión | i
2026-04-11T04:29:12	prompts	6	.agent/prompts/physical_critic.md	0.0000	0.0000	+0.0000	discard	simplify checklist language for Buckling criteria to improve clarity
2026-04-11T04:29:14	prompts	7	.agent/prompts/physical_critic.md	0.0000	0.0000	+0.0000	discard	simplify activation conditions by removing redundant phrasing
2026-04-11T04:29:16	prompts	8	.agent/prompts/physical_critic.md	0.0000	0.0000	+0.0000	discard	clarify alert message formatting by adding brackets around key parameter placeholders
2026-04-11T04:29:18	prompts	9	.agent/prompts/physical_critic.md	0	0.0	0	apply_failed	apply failed: simplify activation conditions by specifying 'structural' changes to model geometry
2026-04-11T04:29:21	prompts	10	.agent/prompts/physical_critic.md	0.0000	0.0000	+0.0000	discard	simplify the identity and role section by removing redundant phrasing for clarity
2026-04-12T04:53:01	prompts	1	.agent/prompts/verifier.md	0.0000	0.0000	+0.0000	discard	simplify the wording of the Gold Rule in the Regla de Oro del Verifier section
2026-04-12T04:53:05	prompts	2	.agent/prompts/verifier.md	0.0000	0.0000	+0.0000	discard	clarify action for missing or empty sensor data files
2026-04-12T04:53:07	prompts	3	.agent/prompts/verifier.md	0.0000	0.0000	+0.0000	discard	simplify the organizational structure of the 'Protocolo de Verificación' to clarify the importance of each step
2026-04-12T04:53:53	prompts	4	.agent/prompts/verifier.md	0.0000	0.0000	+0.0000	discard	simplify language in Regla de Oro for better clarity and effectiveness
2026-04-12T04:53:55	prompts	5	.agent/prompts/verifier.md	0.0000	0.0000	+0.0000	discard	simplify description of the equality check for PASO 0
2026-04-12T04:53:57	prompts	6	.agent/prompts/verifier.md	0	0.0	0	apply_failed	apply failed: simplify the activation conditions by consolidating similar triggers
2026-04-12T04:53:59	prompts	7	.agent/prompts/verifier.md	0.0000	0.0000	+0.0000	discard	simplify the 'Regla de Oro del Verifier' to concise language for clarity
